{
  "$schema": "https://json-schema.org/draft/2020-12/schema",
  "$id": "https://rpg.local/schema/class.schema.json",
  "title": "Classe PHB",
  "description": "Classe de personagem do Livro do Jogador 2024 (PT-BR). Referências (subclasses, magias, talentos) são strings — não há relação de banco.",
  "type": "object",
  "required": [
    "id",
    "name",
    "source",
    "tagline",
    "summary",
    "primaryAbility",
    "hitDie",
    "savingThrowIds",
    "subclassUnlockLevel",
    "subclassLabel",
    "subclasses",
    "features"
  ],
  "properties": {
    "$schema": { "type": "string" },
    "id": {
      "type": "string",
      "pattern": "^[a-z][a-z0-9-]*$",
      "description": "Identificador estável em inglês (slug)."
    },
    "name": { "type": "string", "description": "Nome em português." },
    "source": { "$ref": "#/$defs/source" },
    "tagline": { "type": "string" },
    "summary": { "type": "string" },
    "description": {
      "type": "string",
      "description": "Texto flavor do livro (opcional)."
    },
    "primaryAbility": { "type": "string" },
    "primaryAbilityId": {
      "type": "string",
      "pattern": "^[a-z][a-z0-9-]*$"
    },
    "primaryAbilityIds": {
      "type": "array",
      "items": { "type": "string", "pattern": "^[a-z][a-z0-9-]*$" },
      "minItems": 2,
      "maxItems": 2
    },
    "hitDie": { "type": "string", "pattern": "^D\\d+$" },
    "hitPoints": {
      "type": "object",
      "required": ["level1DieValue", "fixedHpPerLevel", "minimumGainPerLevel"],
      "properties": {
        "level1DieValue": { "type": "integer", "minimum": 4, "maximum": 12 },
        "fixedHpPerLevel": { "type": "integer", "minimum": 4, "maximum": 7 },
        "minimumGainPerLevel": { "type": "integer", "minimum": 1 },
        "constitutionModApplies": { "type": "boolean" }
      }
    },
    "savingThrowIds": {
      "type": "array",
      "items": { "type": "string", "pattern": "^[a-z][a-z0-9-]*$" },
      "minItems": 2,
      "maxItems": 2
    },
    "skillChoices": {
      "type": "object",
      "required": ["count"],
      "properties": {
        "count": { "type": "integer", "minimum": 1 },
        "skillIds": {
          "type": "array",
          "items": { "type": "string", "pattern": "^[a-z][a-z0-9-]*$" }
        },
        "from": {
          "oneOf": [
            { "type": "string", "const": "any" },
            { "type": "array", "items": { "type": "string" } }
          ]
        }
      }
    },
    "weaponProficiencies": {
      "type": "array",
      "items": { "type": "string" }
    },
    "armorTraining": { "$ref": "#/$defs/armorTraining" },
    "toolProficiencies": {
      "type": "array",
      "items": { "type": "string" }
    },
    "startingEquipment": { "$ref": "#/$defs/startingEquipment" },
    "spellcasting": { "$ref": "#/$defs/spellcasting" },
    "progression": { "$ref": "#/$defs/progression" },
    "subclassUnlockLevel": { "type": "integer", "minimum": 1, "maximum": 20 },
    "subclassLabel": {
      "type": "string",
      "description": "Prefixo das subclasses (Trilha, Colégio, etc.)."
    },
    "subclasses": {
      "type": "array",
      "items": { "type": "string" },
      "description": "Ids das subclasses — ver arquivos em subclasses/."
    },
    "related": { "$ref": "#/$defs/related" },
    "features": {
      "type": "array",
      "items": { "$ref": "#/$defs/feature" }
    }
  },
  "$defs": {
    "source": {
      "type": "object",
      "required": ["book", "language", "chapter", "pdfPath"],
      "properties": {
        "book": { "type": "string" },
        "language": { "type": "string" },
        "chapter": { "type": "integer" },
        "chapterTitle": { "type": "string" },
        "pdfPath": { "type": "string" },
        "pdfPages": {
          "type": "array",
          "items": { "type": "integer" },
          "minItems": 2,
          "maxItems": 2
        },
        "extractedAt": { "type": "string", "format": "date-time" }
      }
    },
    "skillChoices": {
      "type": "object",
      "required": ["count"],
      "properties": {
        "count": { "type": "integer", "minimum": 1 },
        "from": {
          "oneOf": [
            { "type": "string", "const": "any" },
            { "type": "array", "items": { "type": "string" } }
          ]
        }
      }
    },
    "armorTraining": {
      "type": "object",
      "required": ["light", "medium", "heavy", "shields"],
      "properties": {
        "light": { "type": "boolean" },
        "medium": { "type": "boolean" },
        "heavy": { "type": "boolean" },
        "shields": { "type": "boolean" }
      }
    },
    "startingEquipment": {
      "type": "object",
      "required": ["options"],
      "properties": {
        "options": {
          "type": "array",
          "items": {
            "type": "object",
            "required": ["label", "items"],
            "properties": {
              "label": { "type": "string" },
              "items": {
                "type": "array",
                "items": { "$ref": "equipment-entry.schema.json" }
              }
            }
          }
        }
      }
    },
    "spellcasting": {
      "type": "object",
      "required": ["type", "ability"],
      "properties": {
        "type": {
          "type": "string",
          "enum": ["full", "half", "pact", "none"]
        },
        "ability": { "type": "string" },
        "focus": { "type": "string" },
        "focusItemId": { "type": "string", "pattern": "^[a-z0-9][a-z0-9-]*$" },
        "ritual": { "type": "boolean" }
      }
    },
    "related": {
      "type": "object",
      "description": "Referências textuais a outros conteúdos do livro.",
      "properties": {
        "spells": {
          "type": "array",
          "items": { "type": "string" }
        },
        "feats": {
          "type": "array",
          "items": { "type": "string" }
        },
        "chapter": { "type": "string" }
      }
    },
    "feature": {
      "type": "object",
      "required": ["level", "name", "description"],
      "properties": {
        "level": { "type": "integer", "minimum": 1, "maximum": 20 },
        "name": { "type": "string" },
        "description": { "type": "string" }
      }
    },
    "spellSlots": {
      "type": "object",
      "description": "Espaços de magia por círculo (chave = círculo 1–9).",
      "propertyNames": { "pattern": "^[1-9]$" },
      "additionalProperties": { "type": "integer", "minimum": 1 }
    },
    "progressionLevel": {
      "type": "object",
      "required": ["level", "proficiencyBonus"],
      "properties": {
        "level": { "type": "integer", "minimum": 1, "maximum": 20 },
        "proficiencyBonus": { "type": "integer", "minimum": 2, "maximum": 6 },
        "cantrips": { "type": "integer", "minimum": 0 },
        "preparedSpells": { "type": "integer", "minimum": 0 },
        "spellSlots": { "$ref": "#/$defs/spellSlots" },
        "pactSlots": { "type": "integer", "minimum": 1 },
        "pactSlotLevel": { "type": "integer", "minimum": 1, "maximum": 5 },
        "channelDivinity": { "type": "integer", "minimum": 0 },
        "wildShape": { "type": "integer", "minimum": 0 },
        "sorceryPoints": { "type": "integer", "minimum": 0 },
        "invocations": { "type": "integer", "minimum": 0 },
        "inspirationDie": { "type": "integer", "enum": [6, 8, 10, 12] },
        "favoredEnemy": { "type": "integer", "minimum": 0 }
      }
    },
    "progression": {
      "type": "object",
      "required": ["tableTitle", "columns", "levels"],
      "additionalProperties": false,
      "properties": {
        "tableTitle": { "type": "string" },
        "columns": {
          "type": "array",
          "minItems": 2,
          "items": { "type": "string" }
        },
        "levels": {
          "type": "array",
          "minItems": 20,
          "maxItems": 20,
          "items": { "$ref": "#/$defs/progressionLevel" }
        }
      }
    }
  }
}
