{
  "$schema": "../../schema/class.schema.json",
  "id": "fighter",
  "name": "Guerreiro",
  "source": {
    "book": "Livro do Jogador 2024",
    "language": "pt-BR",
    "chapter": 3,
    "chapterTitle": "Classes de Personagem",
    "pdfPath": "doc/livro-jogador.pdf",
    "pdfPages": [
      55,
      182
    ],
    "extractedAt": "2026-06-25T01:13:29.372Z"
  },
  "tagline": "Mestre de armas e armaduras",
  "summary": "Domine todas as armas e armaduras.",
  "primaryAbility": "Força ou Destreza",
  "hitDie": "D10",
  "skillChoices": {
    "count": 2,
    "skillIds": [
      "acrobatics",
      "animal-handling",
      "athletics",
      "history",
      "insight",
      "intimidation",
      "perception",
      "survival"
    ]
  },
  "weaponProficiencies": [
    "Armas Simples",
    "Armas Marciais"
  ],
  "armorTraining": {
    "light": true,
    "medium": true,
    "heavy": true,
    "shields": true
  },
  "startingEquipment": {
    "options": [
      {
        "label": "A",
        "items": [
          {
            "id": "chain-mail"
          },
          {
            "id": "longsword"
          },
          {
            "id": "shield"
          },
          {
            "id": "light-crossbow"
          },
          {
            "id": "aljava"
          },
          {
            "id": "kit-de-aventureiro"
          },
          {
            "gold": 4
          }
        ]
      },
      {
        "label": "B",
        "items": [
          {
            "gold": 155
          }
        ]
      }
    ]
  },
  "subclassUnlockLevel": 3,
  "subclassLabel": "Arquétipo",
  "subclasses": [
    "champion",
    "eldritch-knight",
    "psi-warrior",
    "battle-master"
  ],
  "related": {
    "feats": [
      "Aumento no Valor de Atributo",
      "Dádiva Épica"
    ],
    "chapter": "Capítulo 5 — Talentos"
  },
  "features": [
    {
      "level": 1,
      "name": "Estilo de Luta",
      "description": "Você aprimorou suas proezas marciais e tem um\ntalento de Estilo de Luta à sua escolha (veja também o\ncapítulo 5).\nSempre que atinge um nível de Guerreiro, você pode\nsubstituir o talento que escolheu por um talento diferente de Estilo de Luta."
    },
    {
      "level": 1,
      "name": "Maestria em Arma",
      "description": "Seu treinamento com armas permite que você utilize\nas propriedades de maestria com três tipos de armas\nSimples ou Marciais à sua escolha. Sempre que completar um Descanso Longo, você pode praticar movimentos\ncom armas e alterar uma dessas escolhas de armas.\nAo alcançar certos níveis de Guerreiro, você adquire a\nhabilidade de usar as propriedades de maestria de mais\ntipos de armas, conforme mostrado na coluna Maestria\nem Armas da tabela Características de Guerreiro."
    },
    {
      "level": 1,
      "name": "Recuperar Fôlego",
      "description": "Você tem uma reserva limitada de resistência física e\nmental que pode usar. Como uma Ação Bônus, você\npode usá-la para recuperar Pontos de Vida iguais a\n1d10 mais seu nível de Guerreiro.\nVocê pode usar essa característica duas vezes. Você\nrecupera um uso gasto quando completa um Descanso\nCurto e restaura todos os usos gastos quando completa\num Descanso Longo.\nAo atingir certos níveis de Guerreiro, você adquire\nmais usos dessa característica, conforme mostrado na\ncoluna Recuperar Fôlego da tabela Características de\nGuerreiro."
    },
    {
      "level": 2,
      "name": "Mente Tática",
      "description": "Você tem uma mente para táticas dentro e fora do\ncampo de batalha. Ao falhar em um teste de atributo,\nvocê pode gastar um uso de seu Recuperar Fôlego\npara tentar alcançar a vitória. Em vez de recuperar\nPontos de Vida, você joga 1d10 e adiciona o resultado\nao teste de atributo, potencialmente transformando-o\nem sucesso. Se o teste ainda assim falhar, esse uso do\nRecuperar Fôlego não é gasto."
    },
    {
      "level": 2,
      "name": "Surto de Ação",
      "description": "Você pode se esforçar além de seus limites normais por\num momento. No seu turno, você pode executar uma\nação adicional, exceto a ação Usar Magia.\nApós usar esta característica, você não pode usá-la\nnovamente até completar um Descanso Curto ou Longo. A partir do nível 17, você pode usá-lo duas vezes antes de um descanso, mas apenas uma vez em um turno."
    },
    {
      "level": 3,
      "name": "Subclasse de Guerreiro",
      "description": "Você adquire uma subclasse de Guerreiro à sua escolha. As subclasses Campeão, Cavaleiro Místico, Combatente Psíquico e Mestre da Batalha estão detalhadas\napós a descrição desta classe. Uma subclasse é uma\nespecialidade que concede a você características em\ndeterminados níveis de Guerreiro. Pelo resto de sua\njornada, você adquire cada uma das características de\nsua subclasse de seu nível de Guerreiro ou menor."
    },
    {
      "level": 4,
      "name": "Aumento no Valor de Atributo",
      "description": "Você adquire o talento Aumento no Valor de Atributo\n(veja o capítulo 5) ou outro talento à sua escolha para o\nqual atenda os pré-requisitos. Você adquire essa característica novamente nos níveis 6, 8, 12, 14 e 16 de Guerreiro."
    },
    {
      "level": 5,
      "name": "Ajuste Tático",
      "description": "Sempre que executar uma Ação Bônus para seu Recuperar Fôlego, você pode mover-se até metade do seu\nDeslocamento sem provocar Ataques de Oportunidade."
    },
    {
      "level": 5,
      "name": "Ataque Extra",
      "description": "Você pode atacar duas vezes, em vez de uma, sempre\nque executar a ação Atacar no seu turno."
    },
    {
      "level": 9,
      "name": "Indomável",
      "description": "Ao falhar em uma salvaguarda, você pode jogá-la\nnovamente adicionando um bônus igual ao seu nível de\nGuerreiro. Você deve usar o novo resultado e não pode\nusar essa característica novamente até completar um\nDescanso Longo.\nA partir do nível 13, você pode usar essa característica\nduas vezes antes de um Descanso Longo e três vezes\nantes de um Descanso Longo ao atingir o nível 17."
    },
    {
      "level": 9,
      "name": "Mestre Tático",
      "description": "Ao atacar com uma arma cuja propriedade de maestria\nvocê pode usar, você pode substituir essa propriedade\npela propriedade Empurrar, Drenar ou Lentidão para\nesse ataque."
    },
    {
      "level": 11,
      "name": "Dois Ataques Extras",
      "description": "Você pode atacar três vezes, em vez de uma, sempre\nque executar a ação Atacar no seu turno."
    },
    {
      "level": 13,
      "name": "Ataques Estudados",
      "description": "Você estuda seus oponentes e aprende com cada ataque que realiza. Se você realizar uma jogada de ataque\ncontra uma criatura e errar, você tem Vantagem em\nsua próxima jogada de ataque contra essa criatura\nantes do final do seu próximo turno."
    },
    {
      "level": 19,
      "name": "Dádiva Épica",
      "description": "Você adquire o talento Dádiva Épica (veja o capítulo 5)\nou outro talento à sua escolha para o qual se qualifica.\nDádiva da Proeza em Combate é recomendada."
    },
    {
      "level": 20,
      "name": "Três Ataques Extras",
      "description": "Você pode atacar quatro vezes, em vez de uma, sempre\nque executar a ação Atacar no seu turno."
    }
  ],
  "primaryAbilityIds": [
    "forca",
    "destreza"
  ],
  "savingThrowIds": [
    "forca",
    "constituicao"
  ]
}
